{
  "schema_version": "mnf-public-interface-baseline-package/1",
  "normalization_schema_version": "moon-mbti-lossless-lines/1",
  "source_commit": "935e74495a8dd4dc586033a02be2e0aa8e983adb",
  "toolchain": {
    "moon": "moon 0.1.20260713 (75c7e1f 2026-07-13)",
    "moonc": "v0.10.4+2cc641edf (2026-07-15)",
    "moonrun": "moonrun 0.1.20260713 (75c7e1f 2026-07-13)"
  },
  "module": "mb-image",
  "package": "moonbit-foundation/mb-image/metadata",
  "raw_path": "mb-image/metadata/raw.mbti",
  "raw_sha256": "6a3da7f1d4a2bbbdc5716494dfe403cbc3e2e92bff087bc4e304d3e50c24e189",
  "records": [
    {
      "target": "js",
      "normalized_path": "mb-image/metadata/js.mbti",
      "normalized_sha256": "533ed1c078abdda7d2f04b9bb57bb1beb8b16be1b3504dbe32262cd339841c3d",
      "target_inspection": {
        "command": "moon -C modules/mb-image info --target js --frozen",
        "status": "pass",
        "raw_sha256": "6a3da7f1d4a2bbbdc5716494dfe403cbc3e2e92bff087bc4e304d3e50c24e189",
        "matches_canonical": true
      }
    },
    {
      "target": "wasm",
      "normalized_path": "mb-image/metadata/wasm.mbti",
      "normalized_sha256": "533ed1c078abdda7d2f04b9bb57bb1beb8b16be1b3504dbe32262cd339841c3d",
      "target_inspection": {
        "command": "moon -C modules/mb-image info --target wasm --frozen",
        "status": "pass",
        "raw_sha256": "6a3da7f1d4a2bbbdc5716494dfe403cbc3e2e92bff087bc4e304d3e50c24e189",
        "matches_canonical": true
      }
    },
    {
      "target": "wasm-gc",
      "normalized_path": "mb-image/metadata/wasm-gc.mbti",
      "normalized_sha256": "533ed1c078abdda7d2f04b9bb57bb1beb8b16be1b3504dbe32262cd339841c3d",
      "target_inspection": {
        "command": "moon -C modules/mb-image info --target wasm-gc --frozen",
        "status": "pass",
        "raw_sha256": "6a3da7f1d4a2bbbdc5716494dfe403cbc3e2e92bff087bc4e304d3e50c24e189",
        "matches_canonical": true
      }
    },
    {
      "target": "native",
      "normalized_path": "mb-image/metadata/native.mbti",
      "normalized_sha256": "533ed1c078abdda7d2f04b9bb57bb1beb8b16be1b3504dbe32262cd339841c3d",
      "target_inspection": {
        "command": "moon -C modules/mb-image info --target native --frozen",
        "status": "pass",
        "raw_sha256": "6a3da7f1d4a2bbbdc5716494dfe403cbc3e2e92bff087bc4e304d3e50c24e189",
        "matches_canonical": true
      }
    }
  ],
  "two_run_equal": true,
  "claim_scope": "public-interface-text-only; no behavioral, semantic, resource, layout, or performance compatibility claim"
}
