{
  "schema_version": "mnf-public-interface-baseline-package/1",
  "normalization_schema_version": "moon-mbti-lossless-lines/1",
  "source_commit": "935e74495a8dd4dc586033a02be2e0aa8e983adb",
  "toolchain": {
    "moon": "moon 0.1.20260713 (75c7e1f 2026-07-13)",
    "moonc": "v0.10.4+2cc641edf (2026-07-15)",
    "moonrun": "moonrun 0.1.20260713 (75c7e1f 2026-07-13)"
  },
  "module": "mb-image",
  "package": "moonbit-foundation/mb-image/ops",
  "raw_path": "mb-image/ops/raw.mbti",
  "raw_sha256": "06606ec6acc7b3b0aa4aed1cf9181e85daa7ec8ca2fc70b09d4278c749fa62bb",
  "records": [
    {
      "target": "js",
      "normalized_path": "mb-image/ops/js.mbti",
      "normalized_sha256": "599de495861bd31baa76cff4164ec913ad50f2825590a174b46a38bd1a3f3950",
      "target_inspection": {
        "command": "moon -C modules/mb-image info --target js --frozen",
        "status": "pass",
        "raw_sha256": "06606ec6acc7b3b0aa4aed1cf9181e85daa7ec8ca2fc70b09d4278c749fa62bb",
        "matches_canonical": true
      }
    },
    {
      "target": "wasm",
      "normalized_path": "mb-image/ops/wasm.mbti",
      "normalized_sha256": "599de495861bd31baa76cff4164ec913ad50f2825590a174b46a38bd1a3f3950",
      "target_inspection": {
        "command": "moon -C modules/mb-image info --target wasm --frozen",
        "status": "pass",
        "raw_sha256": "06606ec6acc7b3b0aa4aed1cf9181e85daa7ec8ca2fc70b09d4278c749fa62bb",
        "matches_canonical": true
      }
    },
    {
      "target": "wasm-gc",
      "normalized_path": "mb-image/ops/wasm-gc.mbti",
      "normalized_sha256": "599de495861bd31baa76cff4164ec913ad50f2825590a174b46a38bd1a3f3950",
      "target_inspection": {
        "command": "moon -C modules/mb-image info --target wasm-gc --frozen",
        "status": "pass",
        "raw_sha256": "06606ec6acc7b3b0aa4aed1cf9181e85daa7ec8ca2fc70b09d4278c749fa62bb",
        "matches_canonical": true
      }
    },
    {
      "target": "native",
      "normalized_path": "mb-image/ops/native.mbti",
      "normalized_sha256": "599de495861bd31baa76cff4164ec913ad50f2825590a174b46a38bd1a3f3950",
      "target_inspection": {
        "command": "moon -C modules/mb-image info --target native --frozen",
        "status": "pass",
        "raw_sha256": "06606ec6acc7b3b0aa4aed1cf9181e85daa7ec8ca2fc70b09d4278c749fa62bb",
        "matches_canonical": true
      }
    }
  ],
  "two_run_equal": true,
  "claim_scope": "public-interface-text-only; no behavioral, semantic, resource, layout, or performance compatibility claim"
}
